{
 "contract": "blux.blhermes-parity-matrix",
 "matrix_version": 1,
 "inventory": "migration/blhermes/inventory.json",
 "states": [
  "NOT_STARTED",
  "CHARACTERIZED",
  "IN_PROGRESS",
  "MIGRATED",
  "PLANNED_REMOVAL",
  "KEPT_AS_ATTRIBUTION",
  "DEFERRED"
 ],
 "network_dependencies": [
  "none",
  "local",
  "optional",
  "required",
  "build_time"
 ],
 "features": [
  {
   "id": "BLH-001",
   "feature": "Agent conversation loop (turns, tool dispatch, compaction, interrupts)",
   "classification": "MIGRATE",
   "subsystems": [
    "agent.core",
    "tools.registry_glue"
   ],
   "source_locations": [
    "run_agent.py",
    "model_tools.py",
    "agent/agent_init.py",
    "agent/turn_facade.py"
   ],
   "target": {
    "repository": "Outer-Void/blux",
    "module": "runtime/blux_runtime/extensions/agents.py (AgentRunner over model.generate + tool capabilities)",
    "owner": "blux"
   },
   "tests": {
    "characterization": [],
    "upstream": [
     "tests/agent/test_run_agent*",
     "tests/test_agent_close_lifecycle.py",
     "tests/test_model_tools_async_bridge.py"
    ]
   },
   "migration_state": "IN_PROGRESS",
   "provenance": {
    "license": "MIT",
    "holder": "Nous Research",
    "notice": "Copyright (c) 2025 Nous Research",
    "lineage": "credits:LIN-001",
    "requirement": "Clean-room BLUX implementation against the characterization goldens; upstream is cited in credits (LIN-001). If upstream code is copied, the MIT notice travels with it."
   },
   "network": {
    "dependency": "required",
    "endpoints": [
     "Model API (blux-gpt backend)"
    ],
    "policy": "Model calls go only through model.generate; no direct provider SDK use."
   },
   "blocker": "Minimal loop migrated (turns, tool dispatch through the runtime, turn limit); compaction, interrupts and streaming turns are not.",
   "evidence_plan": "Record transcripts of scripted turns (tool call, tool error, interrupt, compaction) through a mock Model API backend; replay against agent.run.",
   "inventory_categories": [
    "module",
    "session"
   ],
   "evidence": [
    "tests/extensions/test_extensions.py::test_agent_loop_runs_tools_through_the_runtime_and_emits_events",
    "tests/extensions/test_extensions.py::test_agents_cannot_skip_approvals",
    "tests/extensions/test_extensions.py::test_agents_cannot_call_tools_they_were_not_given"
   ]
  },
  {
   "id": "BLH-002",
   "feature": "Model provider transport and provider catalogue",
   "classification": "MIGRATE",
   "subsystems": [
    "providers.core",
    "providers.plugins"
   ],
   "source_locations": [
    "providers",
    "hermes_cli/auth.py",
    "agent/provider_registry.py",
    "plugins/model-providers"
   ],
   "target": {
    "repository": "Outer-Void/blux-gpt",
    "module": "bluxgpt/providers/ + routes (logical models)",
    "owner": "blux-gpt"
   },
   "tests": {
    "characterization": [
     "tests/migration/test_blhermes_characterization.py::test_probe_matches_golden[provider_registry]"
    ],
    "upstream": [
     "tests/providers/*",
     "tests/hermes_cli/test_auth*"
    ]
   },
   "migration_state": "IN_PROGRESS",
   "provenance": {
    "license": "MIT",
    "holder": "Nous Research",
    "notice": "Copyright (c) 2025 Nous Research",
    "lineage": "credits:LIN-001",
    "requirement": "Clean-room BLUX implementation against the characterization goldens; upstream is cited in credits (LIN-001). If upstream code is copied, the MIT notice travels with it."
   },
   "network": {
    "dependency": "required",
    "endpoints": [
     "provider APIs listed in the provider_registry golden"
    ],
    "policy": "Provider transport lives only in the BluxGPT backend; BLUX never calls a provider."
   },
   "blocker": "OpenAI, Anthropic, DeepSeek and OpenAI-compatible servers are routed through BluxGPT; the other upstream providers in the provider_registry golden each still need a BluxGPT route (or retirement).",
   "evidence_plan": "Each retained provider becomes a BluxGPT route; compare base URL and credential-variable mapping with the provider_registry golden.",
   "inventory_categories": [
    "provider",
    "url",
    "env_var"
   ],
   "evidence": [
    "tests/models/test_model_api.py::test_a_logical_model_is_served_without_naming_a_provider",
    "tests/integration/test_model_api.py::test_hard_gate_logical_model_without_provider_knowledge",
    "tests/core/test_core_migration.py::test_legacy_provider_credentials_map_onto_bluxgpt_names"
   ]
  },
  {
   "id": "BLH-003",
   "feature": "Nous Portal account, billing and inference (device-code login, subscriptions, invoke JWT)",
   "classification": "REMOVE",
   "subsystems": [
    "cli"
   ],
   "source_locations": [
    "hermes_cli/auth_nous.py",
    "hermes_cli/nous_account.py",
    "hermes_cli/nous_billing.py"
   ],
   "target": null,
   "tests": {
    "characterization": [],
    "upstream": [
     "tests/hermes_cli/test_nous*"
    ]
   },
   "migration_state": "PLANNED_REMOVAL",
   "provenance": {
    "license": "MIT",
    "holder": "Nous Research",
    "notice": "Copyright (c) 2025 Nous Research",
    "lineage": "credits:LIN-001",
    "requirement": "Nothing is ported. The upstream code stays in the fork under MIT; credits keeps the lineage."
   },
   "network": {
    "dependency": "required",
    "endpoints": [
     "portal.nousresearch.com",
     "inference-api.nousresearch.com",
     "welcome-api.nousresearch.com"
    ],
    "policy": "Removed in BLUX; no Nous endpoint is contacted."
   },
   "blocker": null,
   "evidence_plan": "Removal is verified by the inventory: no REMOVE-classified Nous URL or NOUS_* variable may appear in BLUX sources.",
   "inventory_categories": [
    "url",
    "env_var",
    "identifier",
    "provider"
   ],
   "evidence": []
  },
  {
   "id": "BLH-004",
   "feature": "Tool registry and built-in tools",
   "classification": "MIGRATE",
   "subsystems": [
    "tools.builtin"
   ],
   "source_locations": [
    "tools/registry.py",
    "tools/terminal_tool.py",
    "tools/memory_tool.py"
   ],
   "target": {
    "repository": "Outer-Void/blux",
    "module": "runtime/blux_runtime/tools/builtin.py (shell.exec, fs.read, fs.write as capabilities)",
    "owner": "blux"
   },
   "tests": {
    "characterization": [
     "tests/migration/test_blhermes_characterization.py::test_probe_matches_golden[tool_registry]"
    ],
    "upstream": [
     "tests/tools/test_registry*"
    ]
   },
   "migration_state": "IN_PROGRESS",
   "provenance": {
    "license": "MIT",
    "holder": "Nous Research",
    "notice": "Copyright (c) 2025 Nous Research",
    "lineage": "credits:LIN-001",
    "requirement": "Any ported code keeps the upstream MIT notice (LICENSE text + Nous Research copyright) in the BLUX distribution and a per-file provenance header; credits records the file lineage."
   },
   "network": {
    "dependency": "optional",
    "endpoints": [
     "per-tool third-party services (see inventory network_hook items under tools.builtin)"
    ],
    "policy": "Each tool capability declares side_effects: external and its endpoints; policy decides."
   },
   "blocker": "3 core tools migrated; the remaining tools in the tool_registry golden need a capability each (or retirement).",
   "evidence_plan": "Port tools one by one as capabilities; the tool_registry golden lists the names that need a target or an explicit retirement.",
   "inventory_categories": [
    "tool"
   ],
   "evidence": [
    "tests/core/test_core_migration.py::test_shell_exec_runs_safe_commands_with_a_credential_free_environment",
    "tests/core/test_core_migration.py::test_tools_are_confined_and_honour_write_safety",
    "tests/core/test_core_migration.py::test_tool_calls_emit_hook_events_and_a_hook_can_stop_them"
   ]
  },
  {
   "id": "BLH-005",
   "feature": "Toolsets (named tool bundles and resolution)",
   "classification": "MIGRATE",
   "subsystems": [
    "tools.toolsets"
   ],
   "source_locations": [
    "toolsets.py",
    "toolset_distributions.py"
   ],
   "target": {
    "repository": "Outer-Void/blux",
    "module": "runtime/blux_runtime/policy (toolset -> capability grants)",
    "owner": "blux"
   },
   "tests": {
    "characterization": [
     "tests/migration/test_blhermes_characterization.py::test_probe_matches_golden[toolsets]"
    ],
    "upstream": [
     "tests/agent/test_background_review_toolset_restriction.py",
     "tests/gateway/test_api_server_toolset.py"
    ]
   },
   "migration_state": "CHARACTERIZED",
   "provenance": {
    "license": "MIT",
    "holder": "Nous Research",
    "notice": "Copyright (c) 2025 Nous Research",
    "lineage": "credits:LIN-001",
    "requirement": "Clean-room BLUX implementation against the characterization goldens; upstream is cited in credits (LIN-001). If upstream code is copied, the MIT notice travels with it."
   },
   "network": {
    "dependency": "none",
    "endpoints": [],
    "policy": ""
   },
   "blocker": null,
   "evidence_plan": "Toolsets become policy grant bundles; the toolsets golden fixes the resolved membership BLUX must reproduce.",
   "inventory_categories": [
    "toolset"
   ],
   "evidence": []
  },
  {
   "id": "BLH-006",
   "feature": "Terminal execution environments and child-process environment scrubbing",
   "classification": "MIGRATE",
   "subsystems": [
    "tools.environments"
   ],
   "source_locations": [
    "tools/environments/local.py",
    "tools/terminal_tool.py"
   ],
   "target": {
    "repository": "Outer-Void/blux",
    "module": "runtime/blux_runtime/security/environment.py (child_env allow-list) used by shell.exec",
    "owner": "blux"
   },
   "tests": {
    "characterization": [
     "tests/migration/test_blhermes_characterization.py::test_probe_matches_golden[child_env_scrub]"
    ],
    "upstream": [
     "tests/tools/test_local_env*",
     "tests/tools/test_*subprocess_env*"
    ]
   },
   "migration_state": "MIGRATED",
   "provenance": {
    "license": "MIT",
    "holder": "Nous Research",